{
  "schema_version": "1.0.0",
  "title": "Quantum function-learning hypothesis tree",
  "scope": "Study whether randomized QFT-layout quantum circuits recover the canonical two-qubit QFT or perform declared function tasks without recovering the full unitary.",
  "status_vocabulary": [
    "open",
    "supported",
    "not_supported",
    "planned",
    "completed"
  ],
  "metric_conventions": {
    "mse": "Mean squared prediction error on the named split.",
    "absolute_error_over_period": "Pointwise |f_QNN(x)-g(x)| on a dense grid over x in [0,1); report mean and maximum.",
    "circular_angle_change": "(final-initial+pi) mod 2pi - pi; a shortest signed angle difference, not an ordinary subtraction.",
    "process_fidelity": "|Tr(U_target^dagger U_model)|^2/d^2; a normalized Frobenius/Hilbert-Schmidt overlap used only as a diagnostic in the MSE experiment."
  },
  "nodes": [
    {
      "id": "ROOT",
      "parent_id": null,
      "title": "Does a randomly initialized QFT-layout circuit recover QFT or succeed at the task without recovery?",
      "question": "For declared circuit and encoding choices, do randomized parameters converge to the canonical full QFT, and if they do not, can the circuit still predict the target function and recover its frequencies? The goal is to understand these outcomes, not select a best ansatz.",
      "status": "open",
      "observations": [
        "The first scalar experiment uses ideal statevector expectations and supervised MSE only.",
        "The current experiment is a one-frequency proof of method, not evidence for arbitrary-function learning or quantum advantage.",
        "Algorithm recovery and task success are separate outcomes: full-unitary process fidelity assesses QFT recovery, while held-out MSE and frequency-support metrics assess function-task performance.",
        "Zero-offset single-frequency MSE runs reached near-numerical-zero function error while QFT process fidelity remained low, demonstrating task success without full-unitary recovery for that task.",
        "A fixed encoding can be varied while preserving the seven-parameter trainable block, although this changes the overall model function class. Re-uploading between blocks changes the input-dependent circuit; the completed re-upload sweep also changed trainable depth and parameter count."
      ],
      "children": [
        "ENCODING_REVERSIBILITY",
        "CURRENT_FIT",
        "PARAMETER_MOVEMENT",
        "SPECTRAL_COMPLEXITY",
        "QFT_RECOVERY_VS_TASK",
        "ENCODING_FACTOR_DESIGN"
      ]
    },
    {
      "id": "ENCODING_REVERSIBILITY",
      "parent_id": "ROOT",
      "title": "Is the feature encoding reversible on its declared domain?",
      "question": "Does the chosen encoding preserve the input state under its inverse, and what information can measurements recover?",
      "status": "supported",
      "configuration": "x in [0,1) mapped to RY(2*pi*x)|0> on qubit 0; qubit 1 starts in |0>.",
      "hypotheses": [
        {
          "id": "ENCODING_REVERSIBLE_UNITARY",
          "claim": "RY(2*pi*x) is a unitary operation with inverse RY(-2*pi*x), and the encoded pure-state map is injective on [0,1).",
          "status": "supported",
          "basis": "Gate identity and the restricted interval for the real amplitudes cos(pi*x), sin(pi*x).",
          "next_experiment": "Numerically encode a fixed x grid, apply the inverse rotation, and record state fidelity to |0> across the grid."
        },
        {
          "id": "ENCODING_MEASUREMENT_DECODING",
          "claim": "A single measurement does not generally recover an arbitrary continuous x exactly because distinct encoded states are nonorthogonal and outcomes are probabilistic.",
          "status": "supported",
          "next_experiment": "If input decoding becomes a research question, quantify distinguishability and estimator error versus shot count; do not label the measured pipeline lossless."
        }
      ],
      "caveats": [
        "The endpoints are periodic and x=0 and x=1 represent the same point; the declared domain excludes 1."
      ]
    },
    {
      "id": "CURRENT_FIT",
      "parent_id": "ROOT",
      "title": "Why did the first MSE configuration not learn the target perfectly?",
      "question": "The QNN found the correct dominant frequency and improved over a constant predictor, but retained test MSE near 0.0104. Which model or optimization factor limits the fit?",
      "status": "open",
      "experiment": {
        "comparison_group": "periodic-function-mse-ry-angle-encoding-z1-readout",
        "target": "g(x)=0.10+0.55*cos(2*pi*x)+0.25*sin(2*pi*x)",
        "encoding": "RY(2*pi*x)|0> on qubit 0; period-one domain [0,1).",
        "readout": "Ideal Pauli-Z expectation on qubit 1 after the trainable QFT-layout block.",
        "training_objective": "Training-set MSE only. No Frobenius/process-fidelity term, PINN residual, or frequency label.",
        "data": "64 train, 128 validation, 512 test examples; fixed data seed 314159.",
        "trials": "10 initialization seeds, 42 through 51; all use the same data split.",
        "results": {
          "test_mse_mean": 0.010387421433322656,
          "test_mse_population_std": 1.4943549904835434e-10,
          "test_r2_mean": 0.9435097446203621,
          "dominant_frequency_accuracy": "10/10 at k=1",
          "seed_42_dense_grid_fourier_coefficients": {
            "target": {
              "dc": 0.1,
              "cos_k1": 0.55,
              "sin_k1": 0.25
            },
            "qnn_prediction": {
              "dc": 0.0,
              "cos_k1": 0.5212828009013383,
              "sin_k1": 0.2515603887027213
            }
          },
          "seed_42_dense_grid_absolute_error_mean": 0.1,
          "seed_42_dense_grid_absolute_error_max": 0.12875954807820222,
          "constant_predictor_test_mse": 0.1898933590235803,
          "known_frequency_fourier_regression_test_mse": 7.212394812967852e-32,
          "mean_qft_process_fidelity_diagnostic_only": 0.08957405580654812
        },
        "evidence": [
          "results/periodic-function-mse-z1-readout/summary.json",
          "results/periodic-function-mse-z1-readout/index.html",
          "METHODOLOGY.tex Results section"
        ],
        "readout_control_pilot": {
          "group_path": "results/periodic-function-mse",
          "readout": "Pauli-Z on qubit 0 after final SWAP",
          "n_trials": 10,
          "test_mse_mean": 0.18989335868055202,
          "classification": "excluded control pilot; readout expectation was independent of encoded x"
        },
        "zero_offset_control": {
          "comparison_group": "periodic-function-mse-zero-offset-ry-angle-encoding-z1-readout",
          "paired_comparison_group": "periodic-function-mse-ry-angle-encoding-z1-readout",
          "target": "g_0(x)=0.55*cos(2*pi*x)+0.25*sin(2*pi*x)",
          "changed_factor": "target_offset: 0.10 -> 0.0; all circuit, optimizer, harmonic, and data-split factors held fixed",
          "data_seed": 314159,
          "same_input_points_verified": true,
          "input_label_difference": "The paired labels differ by exactly 0.10 on train, validation, and test inputs.",
          "seeds": [
            42,
            43,
            44,
            45,
            46
          ],
          "n_trials": 5,
          "test_mse_mean": 4.042972239649253e-17,
          "test_mse_population_std": 4.089606304447078e-17,
          "validation_mse_mean": 3.8513169911282926e-17,
          "validation_mse_population_std": 3.840199926060435e-17,
          "mean_iterations": 8.0,
          "iterations_population_std": 1.7888543819998317,
          "dominant_frequency_accuracy": "5/5 at k=1",
          "dense_grid_absolute_error_mae_range": [
            2.6646674428337357e-09,
            9.736311043277658e-09
          ],
          "qft_process_fidelity_diagnostic_mean": 0.16011849954156862,
          "qft_process_fidelity_diagnostic_population_std": 0.19900354439445853,
          "interpretation": "The unchanged model fits the zero-DC first harmonic to numerical precision, supporting the structural DC limitation as the cause of the original error floor. Function fitting does not imply full QFT unitary recovery.",
          "scope_limit": "Proof of concept over five initialization seeds on one fixed dataset; this does not measure variation across data seeds.",
          "artifacts": [
            "results/periodic-function-mse-zero-offset-z1-readout/index.html",
            "results/periodic-function-mse-zero-offset-z1-readout/summary.json"
          ]
        }
      },
      "provisional_success_criterion": "For this noiseless benchmark, target test R^2 >= 0.99 (equivalently normalized MSE <= 0.01 using target variance), with correct k=1 support. This is a proposed next milestone, not a preregistered criterion for the completed pilot.",
      "hypotheses": [
        {
          "id": "FIT_ANSATZ_REACHABILITY",
          "claim": "For this exact QFT-layout gate order and Z1 readout after SWAP, the effective observable on encoded qubit 0 is traceless, so the model's period-average/DC component is constrained to zero. The target has DC offset 0.10.",
          "status": "supported",
          "derivation": "Before the final SWAP, measuring Z1 is measuring Z0. The first U prepares qubit 1 in a superposition. Because the controlled-phase gate is diagonal and qubit 1 branches are orthogonal, the reduced effective observable on q0 is a weighted sum of U0^dagger Z U0 and its controlled-phase-rotated conjugate. Each term is traceless; their mixture is traceless. The uniform encoded-circle average state is I/2, giving zero mean prediction.",
          "consequence": "Under a uniform period-one evaluation, a target DC offset b0 produces irreducible MSE at least b0^2 if the nonconstant harmonics are otherwise exact. For b0=0.10 this floor is 0.01.",